{
 "type": "cogneur",
 "nom": "Cogneur de cuivre",
 "car": "z",
 "resume": "Sergent mécanique qui verrouille les couloirs et crache des rafales courtes à moyenne portée, sans jamais fermer complètement le passage.",
 "description": "Châssis humanoïde en plaques de cuivre oxydé, bras droit remplacé par un canon triple à tambour, yeux rouges derrière une visière fissurée, harnais de câbles et étincelles constantes aux épaules.",
 "prompt_image": "copper plated humanoid soldier chassis with triple barrel rotary gun arm, red glowing eyes behind cracked visor, sparking shoulder cables, full body single creature, plain dark background, gritty retro sci-fi horror style",
 "intro": 40,
 "stats": {
  "hp": 120,
  "speed": 1.3,
  "melee": 8,
  "r": 0.35,
  "fly": 0
 },
 "attaque": {
  "mode": "balle",
  "portee": [
   4,
   9
  ],
  "recharge": [
   1.2,
   2.0
  ],
  "degats": [
   6,
   12
  ]
 },
 "role": "mitrailleur",
 "special": "rafale"
}
